{
  "schema_version": "PB30-50-S0-SEED-v1",
  "authority": {
    "drills": "PB30-50_W4B005_Runtime_Spec_v1.0.json / GREEN35 frozen payload",
    "masters": "W4A 13-Master frozen architecture",
    "rule": "Seed content is immutable canonical content. Runtime may reference it but must not rewrite source-owned fields."
  },
  "masters": [
    {
      "master_id": "FM-01",
      "name": "Foundation",
      "class": "FAMILY",
      "source_drill_ids": [
        "DRILL-BALANCE",
        "DRILL-BALANCE-BREATH",
        "DRILL-GRIP",
        "DRILL-READY"
      ]
    },
    {
      "master_id": "FM-02",
      "name": "Serve",
      "class": "FAMILY",
      "source_drill_ids": [
        "DRILL-SERVE-DEPTH",
        "DRILL-SERVE-ROUTINE"
      ]
    },
    {
      "master_id": "FM-03",
      "name": "Return",
      "class": "FAMILY",
      "source_drill_ids": [
        "DRILL-RETURN-DEPTH",
        "DRILL-RETURN-ADVANCE"
      ]
    },
    {
      "master_id": "FM-04",
      "name": "Drive",
      "class": "FAMILY",
      "source_drill_ids": [
        "DRILL-DRIVE-CONTROL",
        "DRILL-DRIVE-5TH",
        "DRILL-SSS-DRIVE"
      ]
    },
    {
      "master_id": "FM-05",
      "name": "Drop",
      "class": "FAMILY",
      "source_drill_ids": [
        "DRILL-DROP-QUALITY",
        "DRILL-DROP-PATH",
        "DRILL-DROP-TRAJECTORY",
        "DRILL-DROP-TARGET",
        "DRILL-SSS-DROP"
      ]
    },
    {
      "master_id": "FM-06",
      "name": "Reset",
      "class": "FAMILY",
      "source_drill_ids": [
        "DRILL-RESET-TOUCH",
        "DRILL-RESET-ADV",
        "DRILL-RESET-VARIANTS",
        "DRILL-SSS-RESET"
      ]
    },
    {
      "master_id": "FM-07",
      "name": "Dink",
      "class": "FAMILY",
      "source_drill_ids": [
        "DRILL-DINK-CONTROL"
      ]
    },
    {
      "master_id": "FM-08",
      "name": "Counter",
      "class": "FAMILY",
      "source_drill_ids": [
        "DRILL-COUNTER-TARGET"
      ]
    },
    {
      "master_id": "FM-09",
      "name": "Leave",
      "class": "FAMILY",
      "source_drill_ids": [
        "DRILL-LEAVE-READ",
        "DRILL-SSS-LEAVE"
      ]
    },
    {
      "master_id": "FM-10",
      "name": "Decision Architecture",
      "class": "SYSTEM/FAMILY",
      "source_drill_ids": [
        "DRILL-3RD-DECISION",
        "DRILL-DECISION-ZONES",
        "DRILL-SSS",
        "DRILL-TARGET"
      ]
    },
    {
      "master_id": "FM-11",
      "name": "Transition Movement",
      "class": "SYSTEM/FAMILY",
      "source_drill_ids": [
        "DRILL-SPLIT",
        "DRILL-ADVANCE",
        "DRILL-TRANSITION"
      ]
    },
    {
      "master_id": "FM-12",
      "name": "Doubles Team Movement",
      "class": "SYSTEM/FAMILY",
      "source_drill_ids": [
        "DRILL-PARTNER-SPACING",
        "DRILL-MIDDLE",
        "DRILL-ROPE"
      ]
    },
    {
      "master_id": "SM-01",
      "name": "Match Transfer",
      "class": "SYSTEM",
      "source_drill_ids": [
        "DRILL-MATCH-RULES"
      ]
    }
  ],
  "drills": [
    {
      "source_drill_id": "DRILL-BALANCE",
      "level_range": "3.0–3.5",
      "progression": "P1–P5",
      "purpose": "Build stable grip/ready/balance/contact foundations supporting later skills.",
      "setup": "Player + paddle; shadow and fed-ball stations.",
      "feed": "Shadow → controlled feed → movement feed.",
      "dose": "3 sets × 10 valid reps; record each valid rep.",
      "success_criterion": "Stable ready/contact/balance rubric across repeated reps.",
      "primary_kpi": "KPI-FOUND",
      "secondary_kpis": "KPI-BALANCE; KPI-MOVE",
      "evidence": "Raw trial result S/P/F/I + scenario/target/quality; session/date; optional video timestamp.",
      "match_transfer": "Finish with constrained points or match segment using the same trigger."
    },
    {
      "source_drill_id": "DRILL-BALANCE-BREATH",
      "level_range": "3.0–3.5",
      "progression": "P1–P5",
      "purpose": "Build stable grip/ready/balance/contact foundations supporting later skills.",
      "setup": "Player + paddle; shadow and fed-ball stations.",
      "feed": "Shadow → controlled feed → movement feed.",
      "dose": "3 sets × 10 valid reps; record each valid rep.",
      "success_criterion": "Stable ready/contact/balance rubric across repeated reps.",
      "primary_kpi": "KPI-FOUND",
      "secondary_kpis": "KPI-BALANCE; KPI-MOVE",
      "evidence": "Raw trial result S/P/F/I + scenario/target/quality; session/date; optional video timestamp.",
      "match_transfer": "Finish with constrained points or match segment using the same trigger."
    },
    {
      "source_drill_id": "DRILL-GRIP",
      "level_range": "3.0–3.5",
      "progression": "P1–P5",
      "purpose": "Build stable grip/ready/balance/contact foundations supporting later skills.",
      "setup": "Player + paddle; shadow and fed-ball stations.",
      "feed": "Shadow → controlled feed → movement feed.",
      "dose": "3 sets × 10 valid reps; record each valid rep.",
      "success_criterion": "Stable ready/contact/balance rubric across repeated reps.",
      "primary_kpi": "KPI-FOUND",
      "secondary_kpis": "KPI-BALANCE; KPI-MOVE",
      "evidence": "Raw trial result S/P/F/I + scenario/target/quality; session/date; optional video timestamp.",
      "match_transfer": "Finish with constrained points or match segment using the same trigger."
    },
    {
      "source_drill_id": "DRILL-READY",
      "level_range": "3.0–3.5",
      "progression": "P1–P5",
      "purpose": "Build stable grip/ready/balance/contact foundations supporting later skills.",
      "setup": "Player + paddle; shadow and fed-ball stations.",
      "feed": "Shadow → controlled feed → movement feed.",
      "dose": "3 sets × 10 valid reps; record each valid rep.",
      "success_criterion": "Stable ready/contact/balance rubric across repeated reps.",
      "primary_kpi": "KPI-FOUND",
      "secondary_kpis": "KPI-BALANCE; KPI-MOVE",
      "evidence": "Raw trial result S/P/F/I + scenario/target/quality; session/date; optional video timestamp.",
      "match_transfer": "Finish with constrained points or match segment using the same trigger."
    },
    {
      "source_drill_id": "DRILL-RETURN-ADVANCE",
      "level_range": "3.0–5.0",
      "progression": "P3–P4",
      "purpose": "Build high-quality deep return and recover toward NVZ.",
      "setup": "Server + returner; deep target zone; NVZ recovery marker.",
      "feed": "Legal serves with controlled then variable depth/pace.",
      "dose": "3 sets × 10 valid reps; record each valid rep.",
      "success_criterion": "Return Quality improves without sacrificing recovery movement.",
      "primary_kpi": "KPI-RETURN",
      "secondary_kpis": "KPI-RETURN-DEPTH; KPI-MOVE",
      "evidence": "Raw trial result S/P/F/I + scenario/target/quality; session/date; optional video timestamp.",
      "match_transfer": "Finish with constrained points or match segment using the same trigger."
    },
    {
      "source_drill_id": "DRILL-RETURN-DEPTH",
      "level_range": "3.0–5.0",
      "progression": "P1–P5",
      "purpose": "Build high-quality deep return and recover toward NVZ.",
      "setup": "Server + returner; deep target zone; NVZ recovery marker.",
      "feed": "Legal serves with controlled then variable depth/pace.",
      "dose": "3 sets × 10 valid reps; record each valid rep.",
      "success_criterion": "Return Quality improves without sacrificing recovery movement.",
      "primary_kpi": "KPI-RETURN",
      "secondary_kpis": "KPI-RETURN-DEPTH; KPI-MOVE",
      "evidence": "Raw trial result S/P/F/I + scenario/target/quality; session/date; optional video timestamp.",
      "match_transfer": "Finish with constrained points or match segment using the same trigger."
    },
    {
      "source_drill_id": "DRILL-SERVE-DEPTH",
      "level_range": "3.0–5.0",
      "progression": "P1–P5",
      "purpose": "Build reliable legal serve, then add depth/target quality.",
      "setup": "Server behind baseline; receiver optional; deep target zones marked.",
      "feed": "Self-feed serve.",
      "dose": "3 × 10 serves; alternate service sides.",
      "success_criterion": "Serve In and/or Serve Depth meets the current prescription target.",
      "primary_kpi": "KPI-SERVE",
      "secondary_kpis": "KPI-SERVE-DEPTH",
      "evidence": "Raw trial result S/P/F/I + scenario/target/quality; session/date; optional video timestamp.",
      "match_transfer": "Finish with constrained points or match segment using the same trigger."
    },
    {
      "source_drill_id": "DRILL-SERVE-ROUTINE",
      "level_range": "3.0–5.0",
      "progression": "P1–P5",
      "purpose": "Build reliable legal serve, then add depth/target quality.",
      "setup": "Server behind baseline; receiver optional; deep target zones marked.",
      "feed": "Self-feed serve.",
      "dose": "3 × 10 serves; alternate service sides.",
      "success_criterion": "Serve In and/or Serve Depth meets the current prescription target.",
      "primary_kpi": "KPI-SERVE",
      "secondary_kpis": "KPI-SERVE-DEPTH",
      "evidence": "Raw trial result S/P/F/I + scenario/target/quality; session/date; optional video timestamp.",
      "match_transfer": "Finish with constrained points or match segment using the same trigger."
    },
    {
      "source_drill_id": "DRILL-DRIVE-5TH",
      "level_range": "3.5–5.0",
      "progression": "P1–P5",
      "purpose": "Use drive as controlled pressure and to create the next ball.",
      "setup": "Hitter near baseline; feeder/opponents at NVZ; target lanes.",
      "feed": "Feed/return to forehand/backhand; progress to live third-shot context.",
      "dose": "3 sets × 10 valid reps; record each valid rep.",
      "success_criterion": "Quality drive to intended target with recoverable next-ball position.",
      "primary_kpi": "KPI-DRIVE",
      "secondary_kpis": "KPI-TARGET; KPI-MOVE",